{
  "schemaVersion": 1,
  "runtime": {
    "type": "opencode",
    "version": "1.18.4",
    "protocol": "HTTP SDK v2 and global SSE",
    "recommendedScope": "worktree"
  },
  "evidence": {
    "capabilityMatrix": "tests/fixtures/opencode/1.18.4/capability-matrix.json",
    "capabilityMatrixSha256": "ada01f809baa0985f38334e666efee33eecd65bf34bff00eb5d23a6756421189",
    "report": "docs/spikes/T0.1-opencode.md"
  },
  "boundaries": {
    "controlChannel": "authenticated HTTP SDK v2 requests",
    "eventChannel": "one independently consumed global SSE stream per Runtime Handle",
    "oneReaderPerHandle": true,
    "runtimeScopeEvents": {
      "name": "runtime_scope_events",
      "supportLevel": "supported",
      "enforcementLevel": "observable_only",
      "commitment": "stage0_evidence",
      "evidence": "server.connected, server.heartbeat, catalog.updated, integration.updated, and plugin.added were observed without fabricated session identifiers"
    },
    "connectionEpoch": {
      "name": "connection_epoch",
      "supportLevel": "unknown",
      "enforcementLevel": "unknown",
      "commitment": "not_committed",
      "evidence": "reconnect occurred but stale approval invalidation was not exercised"
    },
    "eventReplay": {
      "name": "event_replay",
      "supportLevel": "unknown",
      "enforcementLevel": "unknown",
      "commitment": "not_committed",
      "evidence": "native cursor replay was not exercised"
    }
  },
  "capabilities": [
    {
      "name": "worktree_server_lifecycle",
      "supportLevel": "supported",
      "enforcementLevel": "interceptable",
      "commitment": "stage0_evidence",
      "evidence": "password-protected server started in an isolated Windows-native worktree and stopped cleanly"
    },
    {
      "name": "sdk_control_and_independent_sse",
      "supportLevel": "supported",
      "enforcementLevel": "observable_only",
      "commitment": "stage0_evidence",
      "evidence": "SDK commands and one independently consumed global SSE stream correlated session lifecycle events"
    },
    {
      "name": "permission_reply",
      "supportLevel": "supported",
      "enforcementLevel": "interceptable",
      "commitment": "stage0_evidence",
      "evidence": "permission.asked was observed and the host reply controlled whether the safe command executed"
    },
    {
      "name": "turn_abort_and_session_resume",
      "supportLevel": "supported",
      "enforcementLevel": "interceptable",
      "commitment": "stage0_evidence",
      "evidence": "an active turn was aborted and the same session completed a later turn"
    },
    {
      "name": "deepseek_provider_request",
      "supportLevel": "supported",
      "enforcementLevel": "interceptable",
      "commitment": "stage0_evidence",
      "evidence": "dpsk/deepseek-v4-flash completed a real request to api.deepseek.com using config-managed credentials"
    },
    {
      "name": "idle_server_crash_recovery",
      "supportLevel": "supported",
      "enforcementLevel": "interceptable",
      "commitment": "stage0_evidence",
      "evidence": "a restarted server enumerated the persisted session and its messages"
    },
    {
      "name": "in_flight_turn_crash_recovery",
      "supportLevel": "unknown",
      "enforcementLevel": "unknown",
      "commitment": "not_committed",
      "evidence": "the spike crashed the server only after the session returned to idle"
    }
  ],
  "unknowns": [
    "connection_epoch",
    "event_replay",
    "in_flight_turn_crash_recovery",
    "file_change_permission",
    "tool_network_permission"
  ],
  "knownIssues": [
    "In-flight turn recovery was not exercised.",
    "The global SSE stream must be explicitly closed before server shutdown.",
    "Provider-internal transport is not a host security boundary."
  ]
}
